<?xml version="1.0" encoding="UTF-8"?>
<beans xmlns="http://code.google.com/p/firefly/beans"
		xmlns:xsi="http://www.w3.org/2001/XMLSchema-instance"
		xsi:schemaLocation="http://code.google.com/p/firefly/beans http://firefly.googlecode.com/files/beans.xsd">

	<component-scan base-package="com.firefly.demo1"/>
	<mvc view-path="/WEB-INF/page" view-encoding="UTF-8" view-type="fft"/>

	<!-- Datasource -->
	<bean id="dataSource" class="com.jolbox.bonecp.BoneCPDataSource">
		<property name="driverClass" value="${jdbc.driverClassName}" />
		<property name="jdbcUrl" value="${jdbc.url}" />
		<property name="username" value="${jdbc.username}" />
		<property name="password" value="${jdbc.password}" />
		<property name="idleConnectionTestPeriod" value="60" />
		<property name="idleMaxAge" value="240" />
		<property name="maxConnectionsPerPartition" value="30" />
		<property name="minConnectionsPerPartition" value="10" />
		<property name="partitionCount" value="3" />
		<property name="acquireIncrement" value="5" />
		<property name="statementsCacheSize" value="100" />
		<property name="releaseHelperThreads" value="3" />
	</bean>
</beans>
